name,set,rarity,id,ability,Flavor Text,Unique,Loyal,Legendary,Past,Shard,Artist
Bi-Mowercycle,AU,Rare,137,"Equipped Creature has ""Range"" and ""Swift 1.""
Sacrifice Bi-Mowercycle: Target Creature gains ""Range"" and ""Swift 1.""
This Battlegear begins the game face-up.",,,,,,,HotShotsVFX
Citadel Fragments,AU,Common,138,Equipped Creature has an additional 5 Energy and 5 in each Discipline for each Elemental Type it has.,,,,,,,Stone Perales
Citadel Lodestone,AU,Common,139,"When equipped Creature becomes engaged, it gains Earth.",,,,,,,Stone Perales
Colstone,AU,Super Rare,140,"When a Creature engaged with the equipped Creature fails a Discipline check on an attack it played, the equipped Creature gains 10 Energy.",,,,,,,Stone Perales
Double Edge,AU,Common,141,"At the beginning of combat, choose ""Fire 5,"" ""Air 5,"" ""Earth 5"" or ""Water 5."" Equipped Creature gains the chosen ability and ""Recklessness 5.""",,,,,,,"Edwin Nebres, Anthony Washington, Emilio Lopez"
"Drilldozer, Customized Rig",AU,Rare,142,"Equipped Creature has an additional 10 Energy. If equipped Creature has Earth, it has an additional 10 Energy.",,,,,,,HotShotsVFX
Flameblade of Seeryn,AU,Super Rare,143,"Whenever equipped Creature deals 30 or more Fire damage with a single attack, destroy target Battlegear.",,,,,,,Stone Perales
Hyperhover,AU,Rare,144,"Equipped Creature has ""Untargetable"" if it has moved this turn.",,,,,,,HotShotsVFX
Kha'rall Shard of the Staunch,AU,Rare,145,"Equipped Creature has Water.
Equipped Kha'rall has an additional 15 Energy and ""Defender: Water.""
This Battlegear begins the game face-up.",,,,,,1,Stone Perales
Metabolic Overloader,AU,Common,146,"Equipped Creature has ""Expend Fire: Gain 50 Power.""",,,,,,,Peter Bergting
Mysterious Clawblade,AU,Common,147,"Equipped Creature has ""Expend Air: Gain 50 Speed.""",,,,,,,Stone Perales
Orb of Unda,AU,Rare,148,"Sacrifice Orb of Unda: Put a Mugic counter on equipped Creature. If equipped Creature has Water, heal 10 damage from it.",,,,,,,Stone Perales
Orchis Undin,AU,Common,149,"When equipped Creature becomes engaged, it gains Water.",,,,,,,Stone Perales
Phoenix Belt,AU,Rare,150,"Sacrifice Phoenix Belt: Deal 10 damage to target Creature. If equipped Creature has Fire, deal an additional 10 damage.",,,,,,,Stone Perales
Pranker Tanker,AU,Super Rare,151,"At the beginning of each turn, equipped Creature must swap places with another Creature you control.
This Battlegear begins the game face-up.",,,,,,,"Andrew Bradshaw, Anthony Washington, David Rodriguez"
Quranium Pendant,AU,Common,152,"Equipped Creature has ""Expend Earth: Gain 50 Courage.""",,,,,,,Stone Perales
Sandstorm Shroud,AU,Common,153,"When equipped Creature becomes engaged, it gains Air.",,,,,,,Stone Perales
Scarab of Khilai,AU,Super Rare,154,Equipped Creature and Creatures engaged with it cannot lose Elemental Types.,,,,,,,Stone Perales
Skopolon,AU,Super Rare,155,"At the beginning of each turn, you may look at target face-down Battlegear you do not control.
This Battlegear begins the game face-up.",,,,,1,,Stone Perales
Stormbird Statues,AU,Rare,156,"Equipped Creature has ""Swift 1."" If equipped Creature has Air, it has ""Surprise.""
This Battlegear begins the game face-up.",,,,,,,Stone Perales
Sun Chariot of Kehn-Sep,AU,Common,157,"When equipped Creature becomes engaged, it gains Fire.",,,,,,,Stone Perales
Trident of Treachery,AU,Rare,158,"If equipped Creature would deal 20 or more Fire attack damage, it may deal 10 damage to target Creature instead.",,,,,1,,Stone Perales
Ulmanator,AU,Rare,159,Creatures engaged with equipped Creature have 10 less to all Disciplines for each Elemental Type they have.,,,,,,,HotShotsVFX
Varanohs,AU,Rare,160,"Equipped Creature has ""Range"" and ""Swift 1"" for each Creature in your discard pile.
This Battlegear begins the game face-up.",,,,,1,,Stone Perales
"Vlaric Shard, Relic of the Past",AU,Rare,161,"Equipped Creature with Earth deals an additional 5 attack damage.
When you shuffle your Attack Deck, destroy Vlaric Shard.",,,,,1,,Stone Perales
Xerium Armor,AU,Ultra Rare,162,"If equipped Creature would take more than 20 damage from an attack, it takes 20 damage instead.",,1,,,,,"Khary Randolph, Etienne St.Laurent"
Armor of Earthen Might,FAS,Rare,23,"Equipped Creature with Earth takes 10 less damage from Mugic and activated abilities.
This Battlegear begins the game face-up.",,,,,,,Stone Perales
Droskin,OP1,Promo,81,Sacrifice Droskin: Negate target attack. Play this ability only if the equipped Creature is engaged.,The Droskin is rumored to be able to absorb even the most devastating attacks.,1,,,,,"Jimmy Tran, Imaginary Friends Studios"
The Indigo Arc,OP1,Promo,65,"Equipped Creature's first attack each combat has ""Untargetable.""",The blade cuts with such force that neither armor nor Mugic can slow its strikes.,1,,,,,HotShotsVFX
Flux Bauble,OP1,Rare,14,"At the beginning of combat, look at the top two cards of your Location Deck. Put one of them on top of that deck and the other on the bottom.",,,,,,,Imaginary Friends Studios
Orb of Foresight,OP1,Rare,15,"At the beginning of combat, look at the top three cards of your Attack Deck. Put one of them on top of that deck and the other two on the bottom in any order.",,,,,,,Imaginary Friends Studios
Talisman of the Mandiblor,OP1,Super Rare,16,"Equipped Creature has an additional 15 Speed.
If equipped Creature is Danian, it has ""Sacrifice this Creature: Return a Mandiblor from your general discard pile to play in any open space.""",,,,,,,Imaginary Friends Studios
Bodal's Element Converter,LR,Rare,13,"Equipped Creature has ""Fire 5"" and ""Water 5.""
When equipped Creature deals 25 or more damage with a single attack, flip Bodal's Element Converter face-down.",,,,,,,Imaginary Friends Studios
Kha'rall Shard of Chance,LR,Super Rare,14,"Equipped Creature has an additional 5 Energy and Air.
While equipped Kha'rall is engaged, Creatures play attacks at random.",,,,,,1,Imaginary Friends Studios
Mommark's Energy Infuser,LR,Ultra Rare,15,"At the beginning of combat, equipped Creature gains 5 Energy for each Mugic counter on it. The equipped Creature may gain no more than 40 Energy this way.
If equipped Creature has no Mugic counters, destroy it.",,1,,,,,Imaginary Friends Studios
Olkiex' Apron,LR,Uncommon,16,"Equipped Creature has ""When this Creature becomes engaged, flip the opposing engaged Creature's Battlegear face‐down.""",,,,,,,Imaginary Friends Studios